{
  "$schema": "../css-support.schema.json",
  "schemaVersion": 1,
  "id": "non-rendered-html-elements",
  "title": "Non-rendered HTML elements",
  "subjects": {
    "properties": [],
    "elements": [
      "base",
      "link",
      "meta",
      "noscript",
      "script",
      "style",
      "template",
      "title",
      "wbr"
    ]
  },
  "effect": "layout",
  "owner": "taffy-adapter",
  "claims": [
    {
      "id": "document-metadata",
      "description": "Document metadata elements do not generate CSS boxes.",
      "support": "supported",
      "parity": {
        "status": "verified",
        "fixtures": [
          "non-rendered-elements"
        ]
      },
      "notes": [
        {
          "kind": "browser-parity",
          "text": "`base`, `link`, `meta`, and `title` elements are skipped when building the layout and hit-test tree."
        }
      ]
    },
    {
      "id": "source-and-template-content",
      "description": "Source, fallback, and `template` elements do not generate layout boxes in the supported document model.",
      "support": "supported",
      "parity": {
        "status": "verified",
        "fixtures": [
          "non-rendered-elements"
        ]
      },
      "notes": [
        {
          "kind": "browser-parity",
          "text": "`script`, `style`, `template`, and `noscript` elements are skipped when building the layout and hit-test tree."
        }
      ]
    },
    {
      "id": "word-break-opportunities",
      "description": "`wbr` contributes no standalone layout box in the supported text model.",
      "support": "supported",
      "parity": {
        "status": "verified",
        "fixtures": [
          "non-rendered-elements"
        ]
      },
      "notes": []
    }
  ]
}
