{
  "$schema": "../css-support.schema.json",
  "schemaVersion": 1,
  "id": "form-html-elements",
  "title": "Form and interactive HTML elements",
  "subjects": {
    "properties": [],
    "elements": [
      "button",
      "input",
      "textarea",
      "select",
      "option",
      "optgroup",
      "fieldset",
      "legend",
      "form",
      "output",
      "progress",
      "meter"
    ]
  },
  "effect": "layout",
  "owner": "taffy-adapter",
  "claims": [
    {
      "id": "current-supported-scope",
      "support": "partial",
      "parity": {
        "status": "partially-verified",
        "fixtures": [
          "form-control-intrinsic-defaults"
        ]
      },
      "notes": [
        {
          "kind": "browser-parity",
          "text": "button, input text-like controls including size attributes, input button/reset/submit, checkbox, radio, range, color, hidden, file, image with explicit attributes, select including size/multiple attributes, progress, and meter intrinsic sizes have parity coverage as independently positioned controls. Time inputs and textareas have exact parity coverage when author-sized."
        },
        {
          "kind": "implementation-quirk",
          "text": "Common form controls are measured as replaced leaves so option children and anonymous control internals do not participate in the layout tree."
        },
        {
          "kind": "implementation-quirk",
          "text": "Native button text metrics vary with the host Chromium platform; their parity checks use narrow, field-specific tolerances while other claimed control dimensions remain exact."
        },
        {
          "kind": "limitation",
          "text": "The intrinsic width of input[type=time] depends on Chromium's host-native picker UI, so its deterministic default is not claimed as cross-platform pixel parity."
        },
        {
          "kind": "limitation",
          "text": "Native textarea dimensions derived from default rows/cols depend on Chromium host font metrics, so deterministic intrinsic textarea dimensions are not claimed as cross-platform pixel parity."
        },
        {
          "kind": "limitation",
          "text": "Inline form-control formatting, fieldset and legend layout, option popup layout, placeholder text, and most control-specific UA styling are not modeled."
        }
      ]
    }
  ]
}
