{
  "$schema": "../css-support.schema.json",
  "schemaVersion": 1,
  "id": "generic-html-elements",
  "title": "Generic HTML element layout",
  "subjects": {
    "properties": [],
    "elements": [
      "html",
      "body",
      "div",
      "section",
      "article",
      "main",
      "header",
      "footer",
      "nav",
      "aside",
      "address",
      "p",
      "h1",
      "h2",
      "h3",
      "h4",
      "h5",
      "h6",
      "blockquote",
      "figure",
      "figcaption",
      "pre",
      "hr",
      "br",
      "details",
      "summary",
      "dialog"
    ]
  },
  "effect": "layout",
  "owner": "taffy-adapter",
  "claims": [
    {
      "id": "ordinary-block-elements",
      "description": "Ordinary structural elements participate in supported block flow.",
      "support": "supported",
      "parity": {
        "status": "verified",
        "fixtures": [
          "generic-html-defaults",
          "static-block-flow"
        ]
      },
      "notes": [
        {
          "kind": "implementation-quirk",
          "text": "The layout tree gives ordinary elements the same default block style unless author CSS overrides them."
        },
        {
          "kind": "limitation",
          "text": "The document root and body currently form the synthetic viewport containing block rather than independent layout boxes, so their own spacing and box geometry are not modeled."
        }
      ]
    },
    {
      "id": "text-block-defaults",
      "description": "Text-oriented block elements receive a narrow set of user-agent spacing and text defaults.",
      "support": "partial",
      "parity": {
        "status": "verified",
        "fixtures": [
          "generic-html-defaults",
          "figure-html-defaults",
          "hr-html-defaults",
          "static-pre-wrap-text-lines"
        ]
      },
      "notes": [
        {
          "kind": "implementation-quirk",
          "text": "The default `portable` profile gives `address`, `p`, headings, `blockquote`, `figure`, and `pre` a narrow set of user-agent text metrics and spacing defaults; `userAgentStyles.profile` can disable that presentation layer."
        }
      ]
    },
    {
      "id": "details-and-summary",
      "description": "`details` and `summary` elements expose supported open and closed layout behavior.",
      "support": "partial",
      "parity": {
        "status": "verified",
        "fixtures": [
          "details-summary-defaults"
        ]
      },
      "notes": [
        {
          "kind": "limitation",
          "text": "Closed `details` content is suppressed from layout and hit testing; Chromium still exposes non-zero rectangles for suppressed descendants, which this engine does not model."
        }
      ]
    },
    {
      "id": "dialog-open-state",
      "description": "Basic `dialog` open and closed state controls box generation.",
      "support": "partial",
      "parity": {
        "status": "verified",
        "fixtures": [
          "dialog-html-defaults"
        ]
      },
      "notes": [
        {
          "kind": "limitation",
          "text": "Native `dialog` centering, modal top-layer behavior, and `::backdrop` are not modeled."
        }
      ]
    },
    {
      "id": "hidden-attribute",
      "description": "The hidden attribute suppresses supported element layout.",
      "support": "partial",
      "parity": {
        "status": "verified",
        "fixtures": [
          "hidden-attribute"
        ]
      },
      "notes": [
        {
          "kind": "browser-parity",
          "text": "Both ordinary `hidden` and `hidden=until-found` have parity coverage for supported box suppression."
        }
      ]
    }
  ]
}
