{
  "$schema": "../css-support.schema.json",
  "schemaVersion": 1,
  "id": "replaced-elements",
  "title": "Replaced element intrinsic sizing",
  "subjects": {
    "properties": [],
    "elements": ["img", "svg", "canvas", "video", "audio", "iframe", "object"]
  },
  "effect": "layout",
  "owner": "taffy-adapter",
  "claims": [
    {
      "id": "image-attributes",
      "description": "Images use supported width and height attributes for intrinsic sizing.",
      "support": "partial",
      "parity": {
        "status": "verified",
        "fixtures": ["replaced-image-attributes", "replaced-intrinsic-ratio"]
      },
      "notes": [
        {
          "kind": "implementation-quirk",
          "text": "Image width and height attributes are presentational hints. Their ratio supplies the pre-load fallback; loaded natural dimensions supply the intrinsic size and preferred natural ratio. Missing dimensions remain zero for images without a resource."
        },
        {
          "kind": "implementation-quirk",
          "text": "HTML image sizing attributes enter the common cascade as presentational hints. Their aspect ratio remains a fallback for intrinsic sizing; authored aspect-ratio replaces that hint."
        }
      ]
    },
    {
      "id": "intrinsic-ratios",
      "description": "Images, SVG, and canvas derive automatic dimensions from intrinsic ratios before Taffy layout.",
      "support": "partial",
      "parity": {
        "status": "verified",
        "fixtures": ["replaced-intrinsic-ratio", "flex-replaced-intrinsic"]
      },
      "notes": [
        {
          "kind": "browser-parity",
          "text": "Coverage includes loaded PNG natural sizes, image attribute ratio hints, SVG viewBox and numeric dimensions, canvas bitmap dimensions, one-axis CSS sizing, min/max constraints, flex/grid placement, calculated dimensions, authored ratio overrides, and definite border-box dimensions."
        },
        {
          "kind": "implementation-quirk",
          "text": "Taffy 0.14 has no separate natural content-box ratio. Definite border-box constraints are translated to content-box constraints before layout. Image resource load/error events invalidate geometry without requiring an attribute mutation."
        },
        {
          "kind": "limitation",
          "text": "The host must supply decoded image dimensions; the shim does not fetch resources. SVG shapes and canvas pixels have no separate geometry/hit-testing model. SVG attribute lengths beyond numeric/px values and natural-ratio border-box sizing with unresolved percentage constraints are not modeled."
        }
      ]
    },
    {
      "id": "generic-replaced-fallbacks",
      "description": "`svg`, `canvas`, `video`, `iframe`, and empty `object` elements use deterministic fallback dimensions.",
      "support": "partial",
      "parity": {
        "status": "verified",
        "fixtures": ["replaced-image-attributes"]
      },
      "notes": [
        {
          "kind": "implementation-quirk",
          "text": "SVG without intrinsic dimensions or a valid viewBox, canvas without dimensions, video, iframe, and empty object elements use 300x150 fallback dimensions with supported attribute overrides."
        },
        {
          "kind": "implementation-quirk",
          "text": "`object` elements without `type` or `data` resource hints lay out fallback children."
        }
      ]
    },
    {
      "id": "audio-fallbacks",
      "description": "`audio` elements distinguish non-rendered media from controls with deterministic fallback geometry.",
      "support": "partial",
      "parity": {
        "status": "verified",
        "fixtures": ["replaced-image-attributes"]
      },
      "notes": [
        {
          "kind": "implementation-quirk",
          "text": "`audio` elements without `controls` are non-rendered; audio controls use native `300x54` fallback dimensions."
        }
      ]
    },
    {
      "id": "layout-metadata-overrides",
      "description": "Package metadata can provide deterministic intrinsic dimensions for any element.",
      "support": "supported",
      "parity": {
        "status": "not-applicable",
        "fixtures": []
      },
      "notes": [
        {
          "kind": "implementation-quirk",
          "text": "Any element can use `data-layout-width` and `data-layout-height` metadata."
        }
      ]
    }
  ]
}
