{
  "$schema": "../css-support.schema.json",
  "schemaVersion": 1,
  "id": "selector-matching",
  "title": "Selector matching",
  "subjects": {
    "properties": [],
    "elements": []
  },
  "effect": "source",
  "owner": "css-parser",
  "claims": [
    {
      "id": "selector-lists-and-combinators",
      "description": "Selector lists and supported relationship combinators match elements.",
      "support": "supported",
      "parity": {
        "status": "verified",
        "fixtures": ["selector-matching", "selector-sibling-combinators"]
      },
      "notes": [
        {
          "kind": "browser-parity",
          "text": "Selector lists plus descendant, child, adjacent-sibling, and general-sibling combinators have parity coverage."
        }
      ]
    },
    {
      "id": "attribute-and-functional-selectors",
      "description": "Supported attribute, structural, state, and functional pseudo-class selectors participate in matching.",
      "support": "supported",
      "parity": {
        "status": "verified",
        "fixtures": ["selector-matching", "generated-pseudo-elements"]
      },
      "notes": [
        {
          "kind": "limitation",
          "text": "Matching includes case-insensitive terminal HTML attribute selectors, scoped compound `:where()` and `:is()` selectors normalized independently of host matcher quirks, `:not()`, `:has()`, structural selectors, and supported state pseudo-classes. `::before` and `::after` are routed to generated-content measurement rather than matched as ordinary elements."
        }
      ]
    },
    {
      "id": "specificity-and-source-order",
      "description": "Specificity and source-order ties determine the winning supported rule.",
      "support": "supported",
      "parity": {
        "status": "verified",
        "fixtures": ["selector-source-order-tie", "selector-specificity"]
      },
      "notes": []
    },
    {
      "id": "unsupported-selector-policy",
      "description": "Unsupported selectors route through the configured unsupported CSS policy.",
      "support": "supported",
      "parity": {
        "status": "not-applicable",
        "fixtures": []
      },
      "notes": [
        {
          "kind": "implementation-quirk",
          "text": "Unsupported CSS and selectors are ignored with one actionable warning per distinct input by default; strict throw and silent ignore policies remain configurable."
        }
      ]
    },
    {
      "id": "native-css-nesting",
      "description": "Native CSS nesting expands supported selectors and declarations with parent-list specificity and source order.",
      "support": "supported",
      "parity": {
        "status": "verified",
        "fixtures": ["css-nesting"]
      },
      "notes": [
        {
          "kind": "browser-parity",
          "text": "Covers explicit &, implicit descendants, child combinators, multi-level nesting, custom properties, parent selector-list specificity, mixed declarations, and nested viewport media rules. Nested rules remain subject to the supported selector, declaration, and at-rule subsets."
        }
      ]
    }
  ]
}
