{
  "$schema": "../css-support.schema.json",
  "schemaVersion": 1,
  "id": "stylesheet-sources-and-selectors",
  "title": "Stylesheet sources and selectors",
  "subjects": {
    "properties": [],
    "elements": []
  },
  "effect": "source",
  "owner": "css-parser",
  "claims": [
    {
      "id": "current-supported-scope",
      "support": "partial",
      "parity": {
        "status": "partially-verified",
        "fixtures": [
          "selector-matching",
          "selector-source-order-tie",
          "selector-specificity"
        ]
      },
      "notes": [
        {
          "kind": "browser-parity",
          "text": "Configured stylesheets, style elements, CSSOM-inserted style rules, selector lists, specificity, and source-order ties are supported. Static stylesheet and selector behavior is covered by parity fixtures; CSSOM mutation invalidation is covered by package-contract tests."
        },
        {
          "kind": "limitation",
          "text": "External and constructable stylesheets, at-rules, sibling combinators, pseudo-elements, and most pseudo-classes are not implemented."
        },
        {
          "kind": "implementation-quirk",
          "text": "Unsupported CSS is ignored with one actionable warning per distinct declaration by default; strict throw and silent ignore policies remain configurable."
        }
      ]
    }
  ]
}
