{
  "$schema": "../css-support.schema.json",
  "schemaVersion": 1,
  "id": "stylesheet-mutation-invalidation",
  "title": "Stylesheet mutation invalidation",
  "subjects": {
    "properties": [],
    "elements": []
  },
  "effect": "source",
  "owner": "css-parser",
  "claims": [
    {
      "id": "style-element-mutations",
      "description": "Adding, removing, or editing style elements invalidates cached layout snapshots.",
      "support": "supported",
      "parity": {
        "status": "not-applicable",
        "fixtures": []
      },
      "notes": [
        {
          "kind": "implementation-quirk",
          "text": "Package-contract tests verify snapshot invalidation when `style` elements are added, removed, or edited."
        }
      ]
    },
    {
      "id": "cssom-rule-mutations",
      "description": "Inserting, changing, or deleting CSSOM rules invalidates cached layout snapshots.",
      "support": "supported",
      "parity": {
        "status": "not-applicable",
        "fixtures": []
      },
      "notes": [
        {
          "kind": "implementation-quirk",
          "text": "Per-sheet value revisions invalidate parsed CSS; separate structural revisions trigger rule-object discovery only after rule insertion, removal, or replacement. Document stylesheet membership and authored text are cached behind MutationObserver delivery/takeRecords. Sheet identity, disabled state, and adopted-sheet ordering remain checked. Non-patchable CSSOM retains content fingerprinting. Detach releases document-owned revision hooks and mutation observers; shared CSSOM/prototype hooks remain until their final attached owner detaches. Reattachment establishes fresh tracking."
        }
      ]
    }
  ]
}
