{
  "$schema": "../css-support.schema.json",
  "schemaVersion": 1,
  "id": "inline-html-elements",
  "title": "Inline phrasing HTML elements",
  "subjects": {
    "properties": [],
    "elements": [
      "span",
      "a",
      "strong",
      "em",
      "b",
      "i",
      "u",
      "s",
      "small",
      "code",
      "kbd",
      "samp",
      "mark",
      "br",
      "sub",
      "sup",
      "time",
      "label"
    ]
  },
  "effect": "layout",
  "owner": "taffy-adapter",
  "claims": [
    {
      "id": "text-contribution",
      "description": "Native phrasing elements contribute text through ancestor measurement without introducing block-flow breaks.",
      "support": "supported",
      "parity": {
        "status": "verified",
        "fixtures": ["inline-html-defaults", "inline-composition"]
      },
      "notes": [
        {
          "kind": "browser-parity",
          "text": "inline-composition verifies bare text after blocks, nested inline typography, shared fragments and point queries, and preserved whitespace fragments. Inline measurement and projection consume the same styled runs. Offset dimensions use the fragment union and first-fragment origin; inline client dimensions remain zero. Positioned-overlay point queries are covered."
        },
        {
          "kind": "browser-parity",
          "text": "Native phrasing elements contribute text through ancestor measurement without introducing block-flow breaks."
        }
      ]
    },
    {
      "id": "hard-line-breaks",
      "description": "`br` elements introduce hard line breaks in inline-only text subtrees.",
      "support": "supported",
      "parity": {
        "status": "verified",
        "fixtures": ["inline-html-defaults"]
      },
      "notes": []
    },
    {
      "id": "inline-fragment-geometry",
      "description": "Wrapped inline-only text exposes line fragment geometry through `getClientRects()` and union geometry through `getBoundingClientRect()`.",
      "support": "partial",
      "parity": {
        "status": "verified",
        "fixtures": [
          "inline-html-defaults",
          "inline-composition",
          "resize-observer"
        ]
      },
      "notes": [
        {
          "kind": "limitation",
          "text": "Atomic inline replaced elements and baseline effects for sub and sup are not modeled. Native phrasing elements and authored inline text containers share fragment, offset/client, and hit geometry; inline-composition verifies both declaration sources and flex-item blockification."
        },
        {
          "kind": "browser-parity",
          "text": "resize-observer verifies inline fragment origins inside percentage-padded block, flex, and grid items using the same resolved insets as content-box observations."
        }
      ]
    }
  ]
}
