{
  "$schema": "../css-support.schema.json",
  "schemaVersion": 1,
  "id": "stylesheet-sources",
  "title": "Stylesheet sources",
  "subjects": {
    "properties": [],
    "elements": []
  },
  "effect": "source",
  "owner": "css-parser",
  "claims": [
    {
      "id": "configured-and-document-styles",
      "description": "Configured CSS text and document style elements contribute rules in cascade order.",
      "support": "supported",
      "parity": {
        "status": "not-applicable",
        "fixtures": []
      },
      "notes": [
        {
          "kind": "todo",
          "text": "Inline and stylesheet declarations share Lightning CSS parsing and origin/importance ordering. declaration-cascade verifies font-relative declaration order, cross-source importance, and custom-property priority."
        },
        {
          "kind": "implementation-quirk",
          "text": "Configured stylesheet text and document `style` elements are combined with other supported stylesheet sources in cascade order."
        },
        {
          "kind": "implementation-quirk",
          "text": "Parsed source trees and collected rules are cached per attachment and source revision. Changing one sheet preserves other parsed sheets. Selector candidate indexes and matching results are scoped to each layout computation, while pure declaration/selector string caches have bounded capacity."
        }
      ]
    },
    {
      "id": "user-agent-style-origin",
      "description": "A configurable deterministic user-agent presentation layer cascades below author styles.",
      "support": "supported",
      "parity": {
        "status": "not-applicable",
        "fixtures": []
      },
      "notes": [
        {
          "kind": "implementation-quirk",
          "text": "The `portable` profile is enabled by default, `none` disables its presentation defaults, and `userAgentStyles.overrides` adds CSS below document and inline styles. Structural HTML behavior and native-control metrics are separate concerns."
        }
      ]
    },
    {
      "id": "linked-stylesheets",
      "description": "Accessible linked stylesheets contribute readable CSS rules.",
      "support": "partial",
      "parity": {
        "status": "partially-verified",
        "fixtures": ["selector-matching"]
      },
      "notes": [
        {
          "kind": "limitation",
          "text": "Cross-origin or otherwise inaccessible linked stylesheets cannot contribute rules and route through the unsupported CSS policy."
        }
      ]
    },
    {
      "id": "adopted-stylesheets",
      "description": "`document.adoptedStyleSheets` participate in their configured cascade order.",
      "support": "supported",
      "parity": {
        "status": "verified",
        "fixtures": ["adopted-stylesheet-cascade"]
      },
      "notes": [
        {
          "kind": "browser-parity",
          "text": "`document.adoptedStyleSheets` ordering is verified against Chromium."
        }
      ]
    },
    {
      "id": "viewport-media-rules",
      "description": "Viewport media rules select stylesheet branches from the configured layout viewport.",
      "syntax": ["@media <media-query-list> { <style-rules> }"],
      "conditions": [
        "Supported media types are `screen` and `all`; other media types do not match.",
        "Width, height, orientation, and aspect-ratio features use the configured viewport.",
        "Query lists, `not`, `only`, `and`, and nested media rules are supported."
      ],
      "support": "supported",
      "parity": {
        "status": "verified",
        "fixtures": ["media-queries"]
      },
      "notes": [
        {
          "kind": "browser-parity",
          "text": "Wide landscape and narrow portrait fixtures verify matching and non-matching responsive branches against Chromium."
        },
        {
          "kind": "implementation-quirk",
          "text": "Viewport changes reuse parsed stylesheet source trees and re-evaluate media conditions. Inactive branches retain lazy unsupported-CSS policy routing."
        }
      ]
    },
    {
      "id": "at-rules",
      "description": "Stylesheet at-rules other than supported viewport media rules are not part of the source subset.",
      "support": "unsupported",
      "parity": {
        "status": "unverified",
        "fixtures": []
      },
      "notes": [
        {
          "kind": "limitation",
          "text": "Unsupported media features and other at-rules route through the configured unsupported CSS policy."
        }
      ]
    }
  ]
}
